{
  "$schema": "https://json-schema.org/draft/2020-12/schema",
  "$id": "https://faultline.invalid/contracts/coverage-declaration.schema.json",
  "title": "Faultline coverage-declaration",
  "type": "object",
  "additionalProperties": false,
  "properties": {
    "basis": {
      "type": "string",
      "enum": [
        "operator_attestation",
        "lateness_assumption",
        "none"
      ]
    },
    "event_time_intervals": {
      "type": "array",
      "items": {
        "type": "object",
        "additionalProperties": false,
        "properties": {
          "start": {
            "type": "string",
            "format": "date-time",
            "pattern": "^\\d{4}-\\d{2}-\\d{2}T\\d{2}:\\d{2}:\\d{2}\\.\\d{3}Z$"
          },
          "end": {
            "type": "string",
            "format": "date-time",
            "pattern": "^\\d{4}-\\d{2}-\\d{2}T\\d{2}:\\d{2}:\\d{2}\\.\\d{3}Z$"
          }
        },
        "required": [
          "start",
          "end"
        ]
      },
      "minItems": 0,
      "maxItems": 100
    },
    "declared_event_watermark": {
      "anyOf": [
        {
          "type": "string",
          "format": "date-time",
          "pattern": "^\\d{4}-\\d{2}-\\d{2}T\\d{2}:\\d{2}:\\d{2}\\.\\d{3}Z$"
        },
        {
          "type": "null"
        }
      ]
    },
    "statement": {
      "type": "string",
      "minLength": 1,
      "maxLength": 2000
    },
    "reference_evidence_ids": {
      "type": "array",
      "items": {
        "type": "string",
        "pattern": "^[A-Za-z0-9][A-Za-z0-9:_-]{0,127}$"
      },
      "minItems": 0,
      "maxItems": 20
    },
    "late_arrival_hours": {
      "type": "integer",
      "minimum": 0,
      "maximum": 168
    }
  },
  "required": [
    "basis",
    "event_time_intervals",
    "declared_event_watermark",
    "statement",
    "reference_evidence_ids",
    "late_arrival_hours"
  ]
}
